<?xml version="1.0" encoding="UTF-8" standalone="no"?>
<!DOCTYPE table SYSTEM "TableConfig.dtd">
<table>
<name>Stuff</name>
<attributes>
<attribute>
<name>Age</name>
<type>INT</type>
</attribute>
<attribute>
<name>Name</name>
<type>CHAR</type>
</attribute>
</attributes>
<entries>
<entry>
<field>
<name>Age</name>
<type>INT</type>
<value>21</value>
</field>
<field>
<name>Name</name>
<type>CHAR</type>
<value>Jim</value>
</field>
</entry>
<entry>
<field>
<name>Age</name>
<type>INT</type>
<value>25</value>
</field>
<field>
<name>Name</name>
<type>CHAR</type>
<value>Kerry</value>
</field>
</entry>
</entries>
</table>
